{
  "schema_version": "1.0",
  "project_id": "11111111-1111-4111-8111-111111111111",
  "revision": 1,
  "mode": "budgeted",
  "allowed_connection_ids": [
    "22222222-2222-4222-8222-222222222222"
  ],
  "allowed_environment_revision_sha256": [
    "bbbbbbbbbbbbbbbbbbbbbbbbbbbbbbbbbbbbbbbbbbbbbbbbbbbbbbbbbbbbbbbb"
  ],
  "allowed_gpu_types": [
    "a100"
  ],
  "per_job_limits": {
    "cpu_cores": 16,
    "gpu_devices": 1,
    "memory_mib": 32768,
    "time_limit_seconds": 7200,
    "maximum_charge_duration_seconds": 7260
  },
  "max_active_jobs": 2,
  "allowance": {
    "cpu_core_seconds": 360000,
    "gpu_device_seconds": 72000
  },
  "admission_expires_at": "2026-11-01T00:00:00Z"
}
